{
  "schema_version": "1.0.0",
  "claim_id": "e7e3c117f5c5",
  "run_id": "2026-09-08T06:00Z",
  "source": "gong",
  "source_ref": {
    "call_id": "7782934451002",
    "speaker_id": "4521",
    "speaker_name": "Dana Ruiz",
    "affiliation": "External",
    "start_ms": 418000,
    "end_ms": 437000
  },
  "account_id": "ACC-0001",
  "account_name": "Great Lakes Museum Alliance",
  "account_type": "customer",
  "speaker_side": "client",
  "verbatim": "Our renewal invoice came through with the full annual amount and there is no line anywhere showing the dues we already paid in March.",
  "paraphrase": "Renewal invoices do not show the dues already paid earlier in the year.",
  "topic": "renewal invoice credit",
  "product_area": "membership",
  "claim_type": "support_issue",
  "importance": "high",
  "importance_reason": "Finance has to correct every renewal invoice by hand before it goes out.",
  "captured_at": "2026-09-08T06:04:11.512Z",
  "prompt_hash": "80ab0b6e75c1789d",
  "model_tier": "extraction"
}
